A synthesizable time-based LDO using digital standard cells and analog pass transistor,A. Fahmy et al.,"A fully synthesizable analog-like loop filter for a Low-Dropout regulator using only digital standard cells is proposed. To accommodate this, various blocks such as comparator, time-to-digital converter and charge-pumps are developed using only standard cells. The fabricated prototype in 0.13?m process occupying 0.0875mm 2 provides 15mA current with minimum quiescent current of 140?A and load transient response of less than 600ns.",droop voltage and settling time estimated from figure; line regulation and load regulation calculated from data in figure; use total capacity in calculating FoM,2017,ESSCIRC,10.1109/ESSCIRC.2017.8094578,130 nm CMOS,0,0.036,,0.0875,1.2,1,0.2,120,200,15,,15,,400,600,300,99.06,82.55,,,,< 5,,,,50.5,0.8,171.4285714,5.76,0.0864,-,0.0864
A 0.4V 430nA Quiescent Current NMOS Digital LDO with NAND-Based Analog-Assisted Loop in 28nm CMOS,"Xiaofei Ma, Yan Lu1, Rui P. Martins, Qiang Li","In Paper 18.4, the University of Macau presents a digital LDO design that exploits an NMOS power device for intrinsic response to output voltage droops, and employs a high-pass analog path with a voltagedoubled NAND gate to increase conductance during load transients. Together, these techniques enable a 5.1fs speed FoM in a 0.0055mm2 28nm LDO that provides 20mA output current with 50mV minimum dropout.",Coupling capacitor is taken as Cout; current efficiency is calculated based on dIload,2018,ISSCC,https://doi-org.ezproxy.cul.columbia.edu/10.1109/ISSCC.2018.8310306,28nm CMOS,0.012,0.024,,0.0055,0.5,0.45,0.05,117,49,20.5,,20,3,9000,11000,0.81,99.99595,89.996355,-,-,-,-,-,-,-,-,-,3727.272727,0.0028431,0.00012636,0.0635931,0.001271862
A Fully Integrated 40pF Output Capacitor Beat-Frequency-Quantizer-Based Digital LDO with Built-In Adaptive Sampling and Active Voltage Positioning,"Somnath Kundu, Muqing Liu, Richard Wong, Shi-Jie Wen, Chris H. Kim","In Paper 18.5, the University of Minnesota and Cisco describe a new approach to balancing the demands of response time (speed) and quiescent current (power) in a digital LDO. An adaptive sampling frequency is generated via a beat-frequency quantizer. The resulting 0.0374mm2 design in 65nm improves settling time by 25. and voltage droop by 5. over a fixed sampling frequency design and uses a small 40pF output capacitor.",Iq is computed from reported FoM,2018,ISSCC,https://doi-org.ezproxy.cul.columbia.edu/10.1109/ISSCC.2018.8310307,65nm CMOS,0.04,,0.0374,0.0374,1,0.8,0.2,108,148,100,,50,1240,1240,1130,800,99.5,79.6,-37.5,1,-,-,-,-,-,-,-,2673.796791,1.3824,0.0864,9921.3824,496.06912
A 500mA Analog-Assisted Digital-LDO-Based On-Chip Distributed Power Delivery Grid with Cooperative Regulation and IR-Drop Reduction in 65nm CMOS,"Yasu Lu, Fan Yang, Feng Chen, Philip K. T. Mok","In Paper 18.6, the Hong Kong University of Science and Technology presents a 3×3 mesh of analogassisted LDOs that work together to supply 500mA to an unevenly distributed load. Using interleaved phases for clocking, the 9 LDOs work together to improve response speed. The design is fabricated in 65nm CMOS process and employs a 0.9nF on-chip capacitor.",FoM2 is scaled for 9 distributed LDOs; ,2018,ISSCC,https://doi-org.ezproxy.cul.columbia.edu/10.1109/ISSCC.2018.8310308,65nm CMOS,0.9,,0.7758,0.7758,1.2,1.15,0.05,125,45,500,-,450,20,250,1180,500,99.9,95.7375,-,-,-,4,exists; n/d,4,-,,0.833333333,644.4960041,0.277777778,0.108695652,11.38888889,5.125
A Sub-1.55mV-Accuracy 36.9ps-FOM Digital-Low-Dropout Regulator Employing Switched-Capacitor Resistance,"Loai G. Salem, Patrick P. Mercier","In Paper 18.7, the University of California San Diego describes a fully digital LDO that uses a switchedcapacitor resistance to replace the PMOS switch array in conventional digital LDOs. The 65nm CMOS design achieves 99.3% peak current efficiency at 3mA ILOAD, 34.3ps speed FoM and less than 1.5mV steady state error.",,2018,ISSCC,https://doi-org.ezproxy.cul.columbia.edu/10.1109/ISSCC.2018.8310309,65nm CMOS,0.365,,0.00137,0.117,0.9,0.7,0.2,20.5,28.9,3,10,3.25,0.2,7,30,48.4,99.3,77.23333333,-,-,-,3.1,-,3.1,-,-,1.033333333,25.64102564,34.28667456,0.159188132,35.77590533,0.116271692
A High-Efficiency and Fast-Transient Digital-Low-Dropout Regulator with the Burst Mode Corresponding to the Power-Saving Modes of DC-DC Switching Converters,"Jian-He Lin, Yu-Sheng Ma, Chia-Ming Huang, Li-Chi Lin, Chiao-Hung Cheng, Ke-Horng Chen, Ying-Hsi Lin, Shian-Ru Lin, Tsung-Yen Tsai","In Paper 18.8, National Chiao Tung University presents a fully digital LDO in 40nm using a non-linear switch control technique to improve current efficiency by decreasing quiescent current and reducing switching power consumption with variable-switching frequency control. It achieves peak current efficiency of 99.8% at 20mA ILOAD, under 10uA quiescent current, 6mV voltage ripple, and 40mV droop (1.3?s transient response time) on a 1-to-20mA load step.",,2018,ISSCC,https://doi-org.ezproxy.cul.columbia.edu/10.1109/ISSCC.2018.8310310,40nm CMOS,4.7,,0.18,,0.6,0.5,0.1,40,-,20,-,19,400,1300,-,19.6,99.902,83.25166667,-,-,-,3,-,3,150,-,-,-,10.20720222,0.387873684,216.5229917,4.113936842
"0.5V-VIN, 165-mA/mm2 Fully-Integrated Digital LDO based on Event-Driven Self-Triggering Control","Doyun Kim, Sung Kim, Hyunju Ham, Jongwhan Kim, Mingoo Seok","In recent digital low-drop-out (LDO) regulator designs, event-driven (ED) control achieved significantly better scaling in the output capacitor and voltage droop over Time-Driven (TD) one. The state-of-the-art ED LDO design, however, still has several drawbacks including long settling time and low current density. This paper presents a new LDO based on novel self-triggering ED control and initialization. The 0.5V digital LDO in a 65 nm achieves the best-inclass performance in the droop voltage, output capacitor size, settling time, and current density over the prior ED and TD LDOs.",,2018,VLSI,https://doi-org.ezproxy.cul.columbia.edu/10.1109/VLSIC.2018.8502272,65nm CMOS,0.1,,0.0057,0.0342,0.5,0.45,0.05,49.8,-,5.6,-,2.3,0.1,26,-,18.1,99.67678571,89.70910714,-,-,-,-,10,10,-,-,0.7,163.7426901,17.03931947,0.087089855,17.43279773,0.040095435
"The 24-Core POWER9 Processor With Adaptive Clocking, 25-Gb/s Accelerator Links, and 16-Gb/s PCIe Gen4",C. Gonzalez et al.,"The POWER9TM family of chips is fabricated in 14-nm silicon-on-insulator finFET technology using 17 levels of copper interconnect. The 695-mm 2 24-core microprocessor features a new core based on an execution slice microarchitecture. The chip contains 8 billion transistors and has 120 MB of eDRAM L3 cache. The processor features an adaptive clock strategy to reduce timing margin needed during power supply droop events by embedding analog voltage-droop monitors that direct a digital phase-locked loop to immediately reduce clock frequency in response to a droop event. The scale-out chip IO subsystem supports up to 300-GB/s accelerator bandwidth using new 25-Gb/s links, 48 lanes of PCIeGen4 totaling 192 GB/s, eight ports of 2667 MT/s DDR4, and 256 GB/s of symmetric multiprocessor (SMP) interconnect. The scale-up chip adds additional SMP bandwidth and replaces the DDR4 memory interface with eight ports of differential memory interfaces with 230 GB/s of bandwidth resulting in 12.9 Tb/s of total off-chip bandwidth.",not much information about LDO is covered,2018,JSSC,10.1109/JSSC.2017.2748623,14-nm silicon-on-insulator finFET,,,,,,,0,,,,,,,,,,,-,,,,< 5,,,,,,-,-,-,-,-
A 0.7V Fully-on-Chip Pseudo-Digital LDO Regulator with 6.3?A Quiescent Current and 100mV Dropout Voltage in 0.18-?m CMOS,J. Tang et al.,"This paper presents an NMOS pseudo-digital low-dropout (PD-LDO) regulator that supports low-voltage operation by eliminating the amplifier of an analog LDO. The proposed pseudo-digital control loop consists of a latched comparator, a 2X charge pump and a RC network. It detects the output voltage and provides a continuous gate control signal for the power transistor by charging and discharging the RC network. Fast transient response is achieved due to the source follower structure of the power NMOS, with a small output capacitor and small occupied chip area and without consuming large quiescent current. The proof-of-concept design of the proposed PD-LDO is implemented in a 0.18-J.1m CMOS process. The minimum supply voltage is 0.7 V, with a dropout voltage of 100 mV and a maximum load current of 100 mA. Using only 20 pF of on-chip output capacitor and 10 MHz comparator clock frequency, the undershoot is 106 mV with 90 mA load current step and 150 ns edge time. The quiescent current is only 6.3 ?A and the active chip area is 0.08 mm 2 .","output ripple increase with output load, but less than 15mV in all load condition.",2018,ESSCIRC,10.1109/ESSCIRC.2018.8494307,180 nm CMOS,0.03,,,0.08,0.7,0.6,0.1,106,140,100,,90,150,6000,1500,6.3,99.9937,94.44,,,,3,,,,,< 0.17,1250,0.002473333,0.000371,5.252473333,0.4727226
A 320µV-Output Ripple and 90ns-Settling Time at 0.5V Supply Digital-Analog-Hybrid LDO Using Multi-Level Gate-Voltage Generator and Fast-Decision PD Detector,Y. Lim et al.,"This work presents a digital-analog-hybrid LDO (HLDO) using a multi-level gate-voltage generator (MGG) to achieve a small output ripple (VR) and a fast-transient response. Using the MGG that can partially turn on transistors in the power MOSFET (Mp) and thus reduce Mp's LSB current, VR was limited to less than 320 ?V. Also, a fast-decision PD detector having a non-zero decision level expedited the switching of transistors in Mp, thereby reducing the settling time to less than 90 ns.",Iq calculated from reported FoM; Iq = 28 ~ 46.5 uA; FoM ps reported in paper is 40.7; passive area estimated from figure,2018,ESSCIRC,10.1109/ESSCIRC.2018.8494243,65 nm CMOS,0.3,,0.04,0.145,0.5,0.45,0.05,73,70,10,1,5,1,90,90,46.5,99.72,89.748,,,,< 0.32,,,,,0.02,68.96551724,40.734,0.4526,45.384,0.22692
A Switching Linear Regulator Based on a Fast-Self-Clocked Comparator with Very Low Probability of Meta-stability and a Parallel Analog Ripple Control Module,S. Kudva et al.,"Point of load regulators, with fast response to load transients, are becoming critical components in low power systems. Linear regulators are an area-efficient way to implement fast-response regulation as they require only the transistors and capacitors available in any standard CMOS process. This paper presents a switching linear regulator with a comparator that samples the difference between the regulated voltage and the reference (error) at 4GHz. The comparator uses a novel self-clocking scheme to achieve extremely low probability of meta-stability, even at very high clock frequency. In fast transient mode, the regulator achieves zero droop when the load current steps from <; 1mA to 170mA in 100ps. A digital ripple control mechanism, and an analog ripple control module work together to reduce the ripple on the regulated output. The regulator, fabricated in TSMC's 16nm finFET technology, achieves a peak current efficiency of 97.6% when operating at 4GHz.",,2018,CICC,10.1109/CICC.2018.8357021,16 nm finFET,2.7,3.9,0.0132,,1,0.78,0.22,0,,170,,170,0.1,0,,4180.3,97.6,76.128,,,,15.8,,,,,,-,0,0,1.2295,0.209015
A Quasi?Digital Ultra?Fast Capacitor?less Low?Dropout Regulator Based on Comparator Control for x8 Current Spike of PCRAM systems,S. Choi et al.,"This paper presents a comparator-based Quasi-Digital LDO (QDLDO) for the negative supply which has an ultra-fast transient response for the PCRAM systems. Even under the sharp spike of a load current having a peak value of 80 mA with a short rising time of 2.5 ns, the QDLDO effectively minimized a voltage spike on the output voltage, reducing it to 150 mV within only 40 ns. With I/O transistors to withstand I/O voltage stress, this LDO achieved the bestFOM of 0.042 V/um 2 , among the other state-of-the-art LDOs fabricated in more advanced technologies.","in this design, they also reported the load of sudden writing current, where det(load current)=80mA Vovershoot=150mV; Iq calculated from the reported FoM; Iq = 80 ~ 110 uA; passive area estimated from figure",2018,VLSI,10.1109/VLSIC.2018.8502348,180 nm CMOS,3,,0.041,1.361,-3.2,-3,-0.2,30,,10,,9.9,2.5,40,,110,99.1,92.90625,,,,< 10,,,,,1,7.347538575,101.010101,-0.333333333,114.8989899,1.1375
A 0.4V 430nA Quiescent Current NMOS Digital LDO with NAND-Based Analog-Assisted Loop in 28nm CMOS,"Xiaofei Ma, Yan Lu1, Rui P. Martins, Qiang Li","In Paper 18.4, the University of Macau presents a digital LDO design that exploits an NMOS power device for intrinsic response to output voltage droops, and employs a high-pass analog path with a voltagedoubled NAND gate to increase conductance during load transients. Together, these techniques enable a 5.1fs speed FoM in a 0.0055mm2 28nm LDO that provides 20mA output current with 50mV minimum dropout.",Coupling capacitor is taken as Cout; current efficiency is calculated based on dIload,2018,ISSCC,https://doi-org.ezproxy.cul.columbia.edu/10.1109/ISSCC.2018.8310306,28nm CMOS,0.012,0.024,,0.0055,0.4,0.35,0.05,111,46,16,,15,3,408000,410000,0.43,99.99713333,87.49749167,-,-,-,-,-,-,-,-,-,2909.090909,0.0025456,0.000109097,0.0455456,0.000683184
A 0.6-to-1.1V Computationally Regulated Digital LDO with 2.79-Cycle Mean Settling Time and Autonomous Runtime Gain Tracking in 65nm CMOS,"Xun Sun, Akshat Boora, Wenbing Zhang, Venkata Rajesh Pamula, Visvesh Sathe","In Paper 14.5, the University of Washington describes computational power regulation, exploiting computing for highspeed regulation. Measurements indicate a 2.79-cycle mean settling time under nominal conditions.",Iq observed and computed from efficiency plot,2019,ISSCC,https://doi-org.ezproxy.cul.columbia.edu/10.1109/ISSCC.2019.8662298,65nm CMOS,0.25,,0.115525,0.115525,1.1,1,0.1,46,-,16.3,-,5.6,0.1,27.9,-,976,94.01226994,85.46569994,-,-,-,-,-,-,-,-,-,141.0950011,357.9081633,2.004285714,366.622449,2.053085714
"A 745pA Hybrid Asynchronous Binary-Searching and Synchronous Linear-Searching Digital LDO with 3.8×105 Dynamic Load Range, 99.99% Current Efficiency, and 2mV Output Voltage Ripple","Shuo Li, Benton H. Calhoun","In Paper 14.6, the University of Virginia demonstrates a 65nm sub-nA, wide-dynamic-load-range digital LDO with a hybrid asynchronous binary-searching and synchronous linear-searching control scheme. The hybrid DLDO achieves 3.8×105 dynamic load range, 99.99% current efficiency, and 2mV output voltage ripple, consuming 745pA quiescent current.",,2019,ISSCC,https://doi-org.ezproxy.cul.columbia.edu/10.1109/ISSCC.2019.8662533,65nm CMOS,100,,0.04802,-,0.5,0.45,0.05,76.5,37,0.27,0.008,0.27,500,48000,-,0.000745,99.99,89.991,-,-,-,2,-,2.7,-,-,-,-,78.17901235,0.046907407,78.86882716,0.021294583
A Modular Hybrid LDO with Fast Load-Transient Response and Programmable PSRR in 14nm CMOS Featuring Dynamic Clamp Tuning and Time-Constant Compensation,"Xiaosen Liu, Harish K. Krishnamurthy, Taesik Na, Sheldon Weng, Khondker Z. Ahmed, Krishnan Ravichandran, James Tschanz, Vivek De","In Paper 14.7, Intel presents a universal modular hybrid LDO in 14nm CMOS that can be efficiently configured to provide any desired combination of PSRR and load transient response. Measurement results demonstrate up to 42dB of PSR, drawing 27?A with zero ripple.","Reported for the high PSRR version, Iq is computed from reported FoM; high PSRR mode",2019,ISSCC,https://doi-org.ezproxy.cul.columbia.edu/10.1109/ISSCC.2019.8662343,14nm CMOS,0.2,,,0.024,1.1,0.7,0.4,83,-,15,-,15,0.015,-,-,6.37,99.95753333,63.60933939,-30,1,-,-,-,n/a,-,-,-,625,0.469964444,0.010070667,0.473149444,0.007097242
A Modular Hybrid LDO with Fast Load-Transient Response and Programmable PSRR in 14nm CMOS Featuring Dynamic Clamp Tuning and Time-Constant Compensation,"Xiaosen Liu, Harish K. Krishnamurthy, Taesik Na, Sheldon Weng, Khondker Z. Ahmed, Krishnan Ravichandran, James Tschanz, Vivek De","In Paper 14.7, Intel presents a universal modular hybrid LDO in 14nm CMOS that can be efficiently configured to provide any desired combination of PSRR and load transient response. Measurement results demonstrate up to 42dB of PSR, drawing 27?A with zero ripple.","Reported for the high PSRR version, Iq is computed from reported FoM; high power mode",2019,ISSCC,https://doi-org.ezproxy.cul.columbia.edu/10.1109/ISSCC.2019.8662343,14nm CMOS,4,,,0.262,1.1,0.7,0.4,133,-,530,-,506,0.015,-,-,38,99.99283019,63.63180103,-,-,-,-,-,n/a,-,-,-,2022.900763,0.078957647,0.057075099,0.079520888,0.040237569
A 0.5-1V Input Event-Driven Multiple Digital Low-Dropout-Regulator System for Supporting a Large Digital Load,"Sung Justin Kim, Dongkwun Kim, Yu Pu, Chunlei Shi, Mingoo Seok","Recent digital low-dropout regulators have demonstrated competitive load regulation performance for a digital load even with a low input voltage. However, few existing regulator designs have investigated into supporting a spatially large load with realistic grid parasitics. This paper presents a system consisting of nine digital low-drop-out regulators based on event-driven control for better supporting such load. At 0.5V (1V) input, our prototype improves the load regulation FoM by 3.9X (9.1X) and current density by 8.7X (2.8X) over the prior state of the arts.",FoM2 is scaled for 9 distributed LDOs,2019,VLSI,10.23919/VLSIC.2019.8778117,65nm CMOS,0.9,,0.067,0.3726,0.5,0.45,0.05,49.8,,92.7,,36.4,0.1,,,131.4,99.85825243,89.87242718,,,,,,n/a,,,,248.7922705,4.44492513,0.359545055,4.625419635,0.168365275
"A 0.5V-VIN, 0.29ps-Transient-FOM, and Sub-2mV-Accuracy Adaptive-Sampling Digital LDO Using Single-VCO-Based Edge-Racing Time Quantizer",J. Lee et al.,"This work presents a digital LDO using a single-VCO-based edge-racing (SVER) time quantizer to achieve fast transient and high accuracy concurrently. As the SVER scales the sampling frequency dynamically according to the magnitude of the error in the output voltage, the transient response can be improved without the increase in the power consumption in the steady state. Since the SVER uses a single VCO, the accuracy of the output can be high against local mismatches. In measurement, this LDO achieved a 0.29 ps-transient FOM and a sub-2 mV accuracy under 0.5-V supply.",Iq = 25 – 127 uA; overshoot settling time estimated from figure,2019,VLSI,10.23919/VLSIC.2019.8777999,65 nm CMOS,0.1,,,0.0488,0.5,0.45,0.05,47,28,25,,20,400,1200,500,25,99.9,89.91,,,,,,,,,0.072,512.295082,0.29375,0.013055556,250.29375,5.005875
A Single-Controller-Four-Output Analog-Assisted Digital LDO with Adaptive-Time-Multiplexing Control in 65-nm CMOS,Y. Lu et al.,"This paper presents a single-controller-four-output analog-assisted digital LDO which can regulate four output voltage domains by sharing only one digital controller with an adaptive-time-multiplexing control scheme. The area of the digital controller is 62% smaller compared to the sum of the digital controller area of four independent LDOs. An analog-assisted loop and a push-pull auxiliary loop are used to take over the control in steady state to save quiescent power, reduce output ripple and enhance the response speed. A prototype is fabricated in a 65nm CMOS process. An undershoot voltage of 100mV is measured with a 47mA/20ns load step, resulting a figure-of-merit as low as 0.12ps.",single controller four outputs. area is total area. performance is calculated for each output; settling times are estimated from figure,2019,ESSCIRC,10.1109/ESSCIRC.2019.8902511,65 nm CMOS,0.1,,0.0268,,1.2,1.15,0.05,100,100,50,,47,20,70,100,26.25,99.95,95.78541667,,,,5,,,,,,-,0.118832051,0.004856614,5.703938434,0.268085106
A Sub-1V Analog-Assisted Inverter-Based Digital Low-Dropout Regulator with a Fast Response Time at 25mA/100ps and 99.4% Current Efficiency,B. Nguyen et al.,"To mitigate large voltage droop caused by sub-ns dynamic current transitions in system on chips (SoCs), this paper proposes a fully integrated analog-assisted inverter-based digital low dropout regulator (LDO) to obtain a fast response time with 160mV droop at 25mA/100ps featuring 99.4% current efficiency, and 16mV DC load regulation in sub-1V operating range by using a dynamic-step quantizer and a trip-point controller. The proposed quantizer is implemented with an inverter-based flash ADC to achieve high speed without consuming large power while the trip-point controller corrects the DC error of the inverter-based ADC. Besides, the assistant analog LDO is employed to provide fine-grain regulation and remove ripple from the output voltage.","Iq calculated from CE; reported as ripple free, but estimated from figure output ripple ~ 10mV",2019,CICC,10.1109/CICC.2019.8780173,130 nm CMOS,0.8,,,0.118,1,0.8,0.2,160,140,26,,25,0.1,280,250,157,99.4,79.52,,,, ~ 10 mV,,,,,0.615,220.3389831,32.1536,1.0048,32.4676,0.81169
"An Analog-Proportional Digital-Integral Multi-Loop Digital LDO with Fast Reponse, Improved PSR and Zero Minimum Load Current”",M. Huang et al.,"This work presents a multi-loop digital low dropout regulator (DLDO), with analog-proportional (AP) and digital-integral (DI) controls. The DI part is implemented with shift-register-based coarse-fine tuning for good output DC accuracy and fast recovery. Meanwhile, the AP part, based on an improved low-supply flipped-voltage-follower (FVF), can response fast to the load step and supply ripple. A replica loop is used to adaptively control the AP current for a sufficient dynamic current to against supply ripple, and thus further enhances the power supply rejection (PSR). When the load current is smaller than the digital least significant bit (LSB) current, the AP part takes over the LDO control. In such case, the limit cycle oscillation (LCO) is eliminated, and no longer limits the minimum load current to be zero. Implemented in a 65nm CMOS process, a 0.38ps Figure of merit (FoM) and -22dB PSR at 1MHz are measured at 0.6V supply.",settling times are estimated from figure;,2019,CICC,10.1109/CICC.2019.8780307,65 nm CMOS,0.02,,,0.04,0.6,0.55,0.05,65,46,10,0,10,5,50000,10000,29,99.71,91.40083333,-22,1,,5,,,,,,250,0.377,0.006854545,7.627,0.07627
"A Charge-Pump-based LDO Employing an AC-Coupled High-Z Feedback Loop Towards a sub-4fs FoM and a 105,000x Stable Dynamic Current Range",X. Wang et al.,"This paper presents an event-driven charge-pumpbased digital LDO (DLDO) with an AC-coupled high-Z (ACHZ) feedback loop. The proposed DLDO responses in less than a clock cycle during load transients, achieving response and settling times of 6.9ns and 65ns, respectively, all at a 4.9?A quiescent current for a sub-4fs FoM. Thanks to the fine-tuning, sub-Vt detecting, overflow current suppressing, and g m -adjusting weighted-chargepump-based design, the ripple is measured to be <;15mV, and a 105,000x stable load range (1?A to 105mA) is obtained in a 65nm prototype.",feedback cap Cc and C1 are connected to the output with total value of 42pF; edge time can be 1ns with FoM 3.8fs; use total capacity in calculating FoM,2019,CICC,10.1109/CICC.2019.8780214,65 nm CMOS,0,0.042,,0.04,0.6,0.5,0.1,88,83,105,1,100,10,65,103,4.9,99.995,83.32916667,,,,< 15,,,,,,2625,0.00181104,0.000362208,0.24681104,0.024681104
Distributed Network of LDO Microregulators Providing Submicrosecond DVFS and IR Drop Compensation for a 24-Core Microprocessor in 14nm SOI CMOS,M. Perez et al.,"A distributed network of LDO microregulators (uREGs) senses and corrects the voltage at multiple points on a power supply grid in a multi-core microprocessor to reduce IR drops and associated performance loss. Adding a switched-capacitor (SC) accelerator to the charge pump of each uREG speeds up output voltage transitions by 17X for greater DVFS savings. Line and load regulations are 6.7mV/V and 1.5mV/A, respectively. The regulator also achieves a power efficiency of 89.9% and a current efficiency of 98.5%, while reaching a peak power density of 91.1W/mm 2","Iq calculated by CE; Vdropout,min = 0.04V; settling time estimated from figure;",2019,CICC,10.1109/CICC.2019.8780190,14 nm CMOS,481,,0.14,,1.043,0.805,0.238,20,,12000,,4900,10,80,,181218,98.5,76.02348993,,,,,,,,6.7,0.0015,-,72.60796168,441.9615059,257.5242882,1261.869012
Time-Based Digital LDO Regulator with Fractionally Controlled Power Transistor Strength and Fast Transient Response,J. Kang et al.,"The number of enabled power transistors and their ON-time of a digital low-dropout (LDO) regulator are controlled by a time-based controller. By the time-based controller consisting of two voltage-controlled oscillators (VCO) and a phase-detecting switch driver, the effective number of enabled power transistors and therefore their strength can be fractionally controlled. The transient response is greatly improved by a transient detector which selectively disables one of the two VCOs during a transient condition. At steady state, the number of switching power transistor is either zero or one, minimizing the ripple of the output voltage. Implemented in a 65 nm CMOS technology, the time-based digital LDO regulator can provide 0.5 ~ 1.1V output from 0.9 ~ 1.2V input. For the maximum load current of 19 mA, the peak current efficiency is 99.3 %. For both the step-up and -down changes of the load current by 3 mA, the voltage level of the output is stabilized in less than 90 ns.","Vdropout,min = 0.1V; reported FoM ps used load current instead of det(load current) in calculation; edge time is estimated from figure",2019,ASSCC,10.1109/A-SSCC47793.2019.9056901,65 nm CMOS,0.2,,,0.059,1.2,1,0.2,78,80,19,150,3,10,80,90,131,99.3,82.75,,,,< 7,,,,2.63,0.15,322.0338983,227.0666667,0.6812,445.4,1.3362
